{
  "$defs": {
    "InputArtifact": {
      "additionalProperties": true,
      "properties": {
        "artifact_id": {
          "title": "Artifact Id",
          "type": "string"
        },
        "sha256": {
          "title": "Sha256",
          "type": "string"
        }
      },
      "required": [
        "artifact_id",
        "sha256"
      ],
      "title": "InputArtifact",
      "type": "object"
    },
    "Producer": {
      "additionalProperties": true,
      "properties": {
        "commit": {
          "minLength": 1,
          "title": "Commit",
          "type": "string"
        },
        "package": {
          "minLength": 1,
          "title": "Package",
          "type": "string"
        },
        "version": {
          "minLength": 1,
          "title": "Version",
          "type": "string"
        }
      },
      "required": [
        "package",
        "version",
        "commit"
      ],
      "title": "Producer",
      "type": "object"
    }
  },
  "$id": "https://nexus-scholar.org/schemas/contracts/v1/artifact-envelope.schema.json",
  "$schema": "https://json-schema.org/draft/2020-12/schema",
  "additionalProperties": true,
  "properties": {
    "artifact_id": {
      "title": "Artifact Id",
      "type": "string"
    },
    "artifact_type": {
      "minLength": 1,
      "title": "Artifact Type",
      "type": "string"
    },
    "corpus_fingerprint": {
      "title": "Corpus Fingerprint",
      "type": "string"
    },
    "created_at": {
      "format": "date-time",
      "title": "Created At",
      "type": "string"
    },
    "data": {
      "additionalProperties": true,
      "title": "Data",
      "type": "object"
    },
    "inputs": {
      "items": {
        "$ref": "#/$defs/InputArtifact"
      },
      "title": "Inputs",
      "type": "array"
    },
    "producer": {
      "$ref": "#/$defs/Producer"
    },
    "protocol_fingerprint": {
      "title": "Protocol Fingerprint",
      "type": "string"
    },
    "run_id": {
      "title": "Run Id",
      "type": "string"
    },
    "schema_version": {
      "title": "Schema Version",
      "type": "string"
    },
    "workspace_id": {
      "title": "Workspace Id",
      "type": "string"
    }
  },
  "required": [
    "schema_version",
    "artifact_type",
    "artifact_id",
    "created_at",
    "producer",
    "workspace_id",
    "run_id",
    "protocol_fingerprint",
    "corpus_fingerprint",
    "data"
  ],
  "title": "ArtifactEnvelope[dict[str, Any]]",
  "type": "object"
}
