{"artifact_id":"ART-282b232aeaceacc890d3975b52cd2843","artifact_type":"screening_decisions","corpus_fingerprint":"sha256:89ff7b3cbdda29dea52dbef5ad0470f9497d7b7787527a025a2f7d26c668fd51","created_at":"2026-09-21T12:00:00+00:00","data":{"batch_id":"batch-40c247d3fd43623a83e2a09cc0570454","binding":{"corpus_fingerprint":"sha256:89ff7b3cbdda29dea52dbef5ad0470f9497d7b7787527a025a2f7d26c668fd51","criteria_renderer_version":"scholar-protocol-criteria-v1","dedup_configuration_hash":"sha256:d135e20e171ba4a502256d15c60bcbef0beee5bdfcbcaeb3015d6620dc309253","preparation_run_id":"RUN-9d93aed015c5e22ff055f3cc57617402","protocol_fingerprint":"sha256:4442ddb7e6ee4416371d92256ddfc0e4124117429b7a34a3baf5cb7531e8a7f5","screening_run_id":"RUN-9d93aed015c5e22ff055f3cc57617402"},"decisions":[{"decided_at":"2026-09-21T12:00:00Z","decision":"INCLUDE","decision_id":"SCR-2e8c4fc30534da0d6fbd87980b96caf1","method":"HUMAN","model_id":null,"parent_decision_ids":[],"prompt_version":null,"reason":"Meets the frozen inclusion criteria.","screener_id":"human-reviewer-1","study_id":"STU-430807e348c653a3f2cd3348b7dafe4f"},{"decided_at":"2026-09-21T12:00:00Z","decision":"INCLUDE","decision_id":"SCR-9717ad52631cc190ee129245b2bda6b0","method":"HUMAN","model_id":null,"parent_decision_ids":[],"prompt_version":null,"reason":"Meets the frozen inclusion criteria.","screener_id":"human-reviewer-1","study_id":"STU-badf99063e8cc8b1e0fadc35f10e2586"}]},"inputs":[{"artifact_id":"ART-057cef81b0788610cfc921db91ca70d4","sha256":"sha256:f794fd0d66725ddc5614d39a54b2af2020ee1075eb6de54591f64c753c888931"}],"producer":{"commit":"e4363a653796bf43f1d4e5c7428bb4bfe88b8d79","package":"scholar-harness","version":"1.0.0"},"protocol_fingerprint":"sha256:4442ddb7e6ee4416371d92256ddfc0e4124117429b7a34a3baf5cb7531e8a7f5","run_id":"RUN-9d93aed015c5e22ff055f3cc57617402","schema_version":"1.0.0","workspace_id":"WSP-0123456789abcdef0123456789abcdef"}
